{
  "schema": 1,
  "contractVersion": "1.0.0",
  "headOfficeFactoryId": "factory-zero",
  "senderEpoch": 2,
  "sentAt": "2026-10-02T10:00:00Z",
  "shares": [
    {
      "accountKey": "aaaaaaaaaaaaaaaaaaaaaaaaaaaaaaaaaaaaaaaaaaaaaaaaaaaaaaaaaaaaaaaa",
      "share": 40
    }
  ],
  "nudges": [
    {
      "nudgeId": "nudge-a",
      "text": "Slow down until the weekly quota resets."
    }
  ]
}
